{
  "$schema": "../../schemas/weighting-config.schema.json",
  "version": "1.0",
  "description": "Hybrid weighting configuration for state-management benchmarks",
  "categoryWeights": {
    "basic-read": {
      "weight": 0.35,
      "rationale": "Most common operation in real-world apps"
    },
    "reactivity-patterns": {
      "weight": 0.15,
      "rationale": "Core differentiator for reactive state libraries"
    },
    "performance-stress": {
      "weight": 0.15,
      "rationale": "Tests scalability and edge cases"
    },
    "advanced-operations": {
      "weight": 0.15,
      "rationale": "Complex state transformations"
    },
    "basic-write": {
      "weight": 0.10,
      "rationale": "Common but less frequent than reads"
    },
    "async-operations": {
      "weight": 0.05,
      "rationale": "Specialized use case"
    },
    "real-world": {
      "weight": 0.05,
      "rationale": "Integration scenarios"
    }
  },
  "metadata": {
    "lastUpdated": "2025-11-13",
    "author": "benchmark-methodology-team",
    "reviewedBy": "architecture-team"
  }
}
