{
  "$schema": "../../schemas/weighting-config.schema.json",
  "version": "1.0",
  "description": "Hybrid weighting configuration for CSS frameworks benchmarks",
  "categoryWeights": {
    "01-build-performance": {
      "weight": 1.00,
      "rationale": "Build performance is the primary metric for CSS frameworks (single category)"
    }
  },
  "metadata": {
    "lastUpdated": "2025-11-13",
    "author": "benchmark-methodology-team",
    "reviewedBy": "architecture-team"
  }
}
